[
            {
                "name":         "sim1",
                "apn":          "internet.mtt.ru",
                "username":     "vpn11930",
                "password":     "kHye%@09nnBSA",
                "mode":         "auto",
                "enable":       true
            },
            {
                "name":         "sim2",
                "apn":          "vpnapn.msk.by",
                "username":     "user9234729",
                "password":     "0912hbjahse6898ryfha",
                "mode":         "lte",
                "enable":       true
            }
]
